{
  "base": "LB26001-A-04-006",
  "part_class": "long_thin",
  "drawing_purpose": "manufacturing",
  "manufacturing_intent": "make_or_inspect",
  "reference_base": "LB26001-A-04-006",
  "schema": "sw_drawing_studio.drawing_blueprint.v4",
  "version": "v4.0",
  "generated_at": "2026-06-23 16:37:31",
  "view_plan": [
    {
      "slot": "front",
      "view_type": "named",
      "required": true,
      "source": "reference_profile",
      "center_norm": [
        0.3704,
        0.8074
      ],
      "scale": "reference",
      "sw_view_type": "7",
      "create_method": "named_view",
      "projected_from": "",
      "outline_norm": [
        0.1627,
        0.7719,
        0.5781,
        0.8429
      ],
      "reasons": [
        "same_name_reference_view_position",
        "named_or_model_view_from_reference"
      ]
    },
    {
      "slot": "top",
      "view_type": "projected",
      "required": true,
      "source": "reference_profile",
      "center_norm": [
        0.3704,
        0.5948
      ],
      "scale": "reference",
      "sw_view_type": "4",
      "create_method": "projection_api",
      "projected_from": "front",
      "outline_norm": [
        0.1627,
        0.5605,
        0.5781,
        0.6291
      ],
      "reasons": [
        "same_name_reference_view_position",
        "projected_view_requires_projection_api"
      ]
    },
    {
      "slot": "right",
      "view_type": "projected",
      "required": true,
      "source": "reference_profile",
      "center_norm": [
        0.7259,
        0.8074
      ],
      "scale": "reference",
      "sw_view_type": "4",
      "create_method": "projection_api",
      "projected_from": "front",
      "outline_norm": [
        0.7016,
        0.7719,
        0.7501,
        0.8429
      ],
      "reasons": [
        "same_name_reference_view_position",
        "projected_view_requires_projection_api"
      ]
    },
    {
      "slot": "iso",
      "view_type": "iso",
      "required": true,
      "source": "reference_profile",
      "center_norm": [
        0.8025,
        0.478
      ],
      "scale": "reference",
      "sw_view_type": "7",
      "create_method": "named_view",
      "projected_from": "",
      "outline_norm": [
        0.7164,
        0.3929,
        0.8886,
        0.5631
      ],
      "reasons": [
        "same_name_reference_view_position",
        "named_or_model_view_from_reference"
      ]
    }
  ],
  "dimension_plan": {
    "required_display_dim_count": 12,
    "reference_display_dim_count": 12,
    "required_overall_dims": [
      "overall_length",
      "overall_diameter"
    ],
    "hole_dims": [],
    "slot_dims": [],
    "radius_dims": [],
    "thread_dims": [],
    "datum_dims": [],
    "inspection_dims": [],
    "dimension_intent_groups": [
      {
        "key": "overall_envelope",
        "label": "overall length/width/height",
        "target_views": [
          "front",
          "top",
          "right"
        ],
        "required_count": 3,
        "source_reference_rule": "match same-name 006 envelope dimensions"
      },
      {
        "key": "end_offsets",
        "label": "left and right end offsets",
        "target_views": [
          "top"
        ],
        "required_count": 2,
        "source_reference_rule": "keep end-offset dimensions outside the long top view"
      },
      {
        "key": "hole_locations",
        "label": "hole diameter and center locations",
        "target_views": [
          "top"
        ],
        "required_count": 4,
        "source_reference_rule": "group hole callouts into the compact right-side leader lane seen in the same-name reference"
      },
      {
        "key": "small_projected_view",
        "label": "right-side projected view size and small-feature location",
        "target_views": [
          "right"
        ],
        "required_count": 3,
        "source_reference_rule": "dimension the small projection without replacing it with a named view"
      },
      {
        "key": "radius_chamfer_thread",
        "label": "radius/chamfer/thread callouts when detected",
        "target_views": [
          "front",
          "top",
          "right"
        ],
        "required_count": 0,
        "optional": true,
        "source_reference_rule": "add only when geometry/reference notes prove the feature is present"
      }
    ],
    "dimension_targets": [
      {
        "key": "overall_length",
        "group": "overall_envelope",
        "source_reference": "C:\\Users\\Vision\\Desktop\\SW 相关\\3D转2D测试图纸\\LB26001-A-04-006.SLDDRW",
        "target_view": "front",
        "expected_type": "linear_horizontal",
        "preferred_side": "above",
        "priority": 10,
        "fallback_policy": "need_review_when_real_displaydim_unavailable",
        "create_as": "SolidWorks DisplayDim",
        "forbid_note_substitution": true,
        "avoid_generic_model_annotation": true
      },
      {
        "key": "overall_width",
        "group": "overall_envelope",
        "source_reference": "C:\\Users\\Vision\\Desktop\\SW 相关\\3D转2D测试图纸\\LB26001-A-04-006.SLDDRW",
        "target_view": "top",
        "expected_type": "linear_vertical",
        "preferred_side": "right",
        "priority": 11,
        "fallback_policy": "need_review_when_real_displaydim_unavailable",
        "create_as": "SolidWorks DisplayDim",
        "forbid_note_substitution": true,
        "avoid_generic_model_annotation": true
      },
      {
        "key": "overall_height",
        "group": "overall_envelope",
        "source_reference": "C:\\Users\\Vision\\Desktop\\SW 相关\\3D转2D测试图纸\\LB26001-A-04-006.SLDDRW",
        "target_view": "right",
        "expected_type": "linear_vertical",
        "preferred_side": "right",
        "priority": 12,
        "fallback_policy": "need_review_when_real_displaydim_unavailable",
        "create_as": "SolidWorks DisplayDim",
        "forbid_note_substitution": true,
        "avoid_generic_model_annotation": true
      },
      {
        "key": "left_end_offset",
        "group": "end_offsets",
        "source_reference": "C:\\Users\\Vision\\Desktop\\SW 相关\\3D转2D测试图纸\\LB26001-A-04-006.SLDDRW",
        "target_view": "top",
        "expected_type": "linear_horizontal",
        "preferred_side": "below",
        "priority": 20,
        "fallback_policy": "need_review_when_real_displaydim_unavailable",
        "create_as": "SolidWorks DisplayDim",
        "forbid_note_substitution": true,
        "avoid_generic_model_annotation": true
      },
      {
        "key": "right_end_offset",
        "group": "end_offsets",
        "source_reference": "C:\\Users\\Vision\\Desktop\\SW 相关\\3D转2D测试图纸\\LB26001-A-04-006.SLDDRW",
        "target_view": "top",
        "expected_type": "linear_horizontal",
        "preferred_side": "below",
        "priority": 21,
        "fallback_policy": "need_review_when_real_displaydim_unavailable",
        "create_as": "SolidWorks DisplayDim",
        "forbid_note_substitution": true,
        "avoid_generic_model_annotation": true
      },
      {
        "key": "hole_diameter",
        "group": "hole_locations",
        "source_reference": "C:\\Users\\Vision\\Desktop\\SW 相关\\3D转2D测试图纸\\LB26001-A-04-006.SLDDRW",
        "target_view": "top",
        "expected_type": "diameter",
        "preferred_side": "callout_right",
        "priority": 30,
        "fallback_policy": "need_review_when_real_displaydim_unavailable",
        "create_as": "SolidWorks DisplayDim",
        "forbid_note_substitution": true,
        "avoid_generic_model_annotation": true
      },
      {
        "key": "hole_x_location",
        "group": "hole_locations",
        "source_reference": "C:\\Users\\Vision\\Desktop\\SW 相关\\3D转2D测试图纸\\LB26001-A-04-006.SLDDRW",
        "target_view": "top",
        "expected_type": "linear_horizontal",
        "preferred_side": "above",
        "priority": 31,
        "fallback_policy": "need_review_when_real_displaydim_unavailable",
        "create_as": "SolidWorks DisplayDim",
        "forbid_note_substitution": true,
        "avoid_generic_model_annotation": true
      },
      {
        "key": "hole_y_location",
        "group": "hole_locations",
        "source_reference": "C:\\Users\\Vision\\Desktop\\SW 相关\\3D转2D测试图纸\\LB26001-A-04-006.SLDDRW",
        "target_view": "top",
        "expected_type": "linear_vertical",
        "preferred_side": "callout_right",
        "priority": 32,
        "fallback_policy": "need_review_when_real_displaydim_unavailable",
        "create_as": "SolidWorks DisplayDim",
        "forbid_note_substitution": true,
        "avoid_generic_model_annotation": true
      },
      {
        "key": "hole_pitch",
        "group": "hole_locations",
        "source_reference": "C:\\Users\\Vision\\Desktop\\SW 相关\\3D转2D测试图纸\\LB26001-A-04-006.SLDDRW",
        "target_view": "top",
        "expected_type": "linear_horizontal",
        "preferred_side": "above",
        "priority": 33,
        "fallback_policy": "need_review_when_real_displaydim_unavailable",
        "create_as": "SolidWorks DisplayDim",
        "forbid_note_substitution": true,
        "avoid_generic_model_annotation": true
      },
      {
        "key": "projection_view_width",
        "group": "small_projected_view",
        "source_reference": "C:\\Users\\Vision\\Desktop\\SW 相关\\3D转2D测试图纸\\LB26001-A-04-006.SLDDRW",
        "target_view": "right",
        "expected_type": "linear_horizontal",
        "preferred_side": "above",
        "priority": 40,
        "fallback_policy": "need_review_when_real_displaydim_unavailable",
        "create_as": "SolidWorks DisplayDim",
        "forbid_note_substitution": true,
        "avoid_generic_model_annotation": true
      },
      {
        "key": "projection_view_height",
        "group": "small_projected_view",
        "source_reference": "C:\\Users\\Vision\\Desktop\\SW 相关\\3D转2D测试图纸\\LB26001-A-04-006.SLDDRW",
        "target_view": "right",
        "expected_type": "linear_vertical",